{
  "version": "1.0.0",
  "run_id": "claims-007",
  "candidate_commit": null,
  "settings": {
    "angles": [
      "auth-funds"
    ],
    "budget_usd": 15,
    "timeout_minutes": 60,
    "skeptic_budget_usd": 5,
    "skeptic_timeout_minutes": 20,
    "max_findings": 8,
    "requirements": [
      "docs/security/requirements.md"
    ],
    "secret_files": [
      "/home/agentops/.config/vps-wallet.env"
    ]
  },
  "status": "refused",
  "started_at": "2026-10-05T10:00:00Z",
  "finished_at": "2026-10-05T10:00:01Z",
  "error": "/home/agentops/.config/vps-wallet.env exists on this host",
  "attackers": [],
  "findings": []
}
